created_at,id,text,favorite_count,retweet_count,user_id_str,user_name,user_screen_name,user_location,user_description,user_friends_count,user_followers_count,hashtags,mentions
Thu Sep 19 20:22:54 +0000 2019,1174780927249174530,Immigration was not a major issue in public consciousness until the refugee crisis. Corporate media gave a platform… https://t.co/msbISa6svO,2,1,1026201375129194496,Steven McCallum,SMcCallum93,"Glasgow, Scotland","🏴󠁧󠁢󠁳󠁣󠁴󠁿 | UoG 👨🏼‍🎓 | Sociology MA (Hons) 🌐 | Human Rights; Social, Economic and Racial Justice ✊🏼 | Internationalist 🌍 | Books 📚 | 🖤",3070,425,,
Thu Sep 19 21:40:17 +0000 2019,1174800402941980672,"Candidate @JulianCastro focuses on the human impact of #climatechange, wants to alter immigration law to include “c… https://t.co/haxVw85X02",6,1,2892886959,Cristine Pedersen,cristinemariep,"Portland, OR | Washington, DC","Marine turned diplomat | @TrumanProject | @trumanapp | @pattillmanfnd | pug momma | comedienne @ASAP_vets  
Dignity & security for all, please.",2037,2000,,FraserNelson
Thu Sep 19 21:32:44 +0000 2019,1174798504134397962,"https://t.co/3hLy6YfQua

@KenCuccinelli  only Department of Homeland Security secretary has the ability to disclose… https://t.co/TFBTDEOcMk",1,1,1104592557504425984,Bruce,Kebru13,,"Asylum for @basmanasser_🇫🇷
pls support @Retaj95863116🇾🇪 @Warda12112002🇵🇰🇧🇩@AxFLBxGsSjFoh7k🇸🇾 @UmmaraTabbsum🇵🇰 @John_Arash2345🇮🇷 @maya24052097🇾🇪",412,320,,
Thu Sep 19 22:54:33 +0000 2019,1174819091221286916,"#MigrantCrisis &amp; #Crime (Sept 19, 2019 EDN): Most fleeing to #Europe are  ‘not refugees’, #EU official says –… https://t.co/Tii4cyDQHi",0,1,144737971,Infinite Unknown,SecretNews,,#BreakingNews; #Politics; #Economics; #Science; #Technology; #Health; #Environment; #Business; #Society; #Conspiracies; #NWO; #Fukushima;#Geoengineering;#WTF,1445,1456,,
Thu Sep 19 19:42:22 +0000 2019,1174770727544733697,"RT @CitImmCanada: If you lose your permanent resident card outside Canada, you must apply for a permanent resident travel document in order…",0,0,816068904044769280,MCN Canada Immigration Consulting Inc.,mcn_canada,"Edmonton, Alberta",Regulated Canadian Immigration Consultant,84,267,,
Sat Sep 28 21:28:06 +0000 2019,1178058827658354693,"WATCH: @RachelBros, #GlobalCitizen ambassador and star of 'The Marvelous Mrs. Maisel', discusses her work supportin… https://t.co/vH97YGMWMc",70,20,2836421,MSNBC,MSNBC,,"#MSNBC2020: The place for in-depth analysis, political commentary and diverse perspectives. Home of @MSNBCDaily.",737,3887415,,tlshields85
Sat Sep 28 23:30:01 +0000 2019,1178089507930939400,"""Without foreign language fluency, an officer is unlikely to know whether a post needs additional review,"" says Bre… https://t.co/YyIMva27tv",20,12,20707070,Brennan Center,BrennanCenter,New York & Washington D.C.,"We are a nonpartisan law and policy institute working to reform, revitalize, and defend our country’s systems of democracy and justice.",3373,167246,,
Sat Sep 28 22:01:13 +0000 2019,1178067161383878656,"The Trump Administration has slashed the American refugee program by almost half.
These limits on resettlement are… https://t.co/JYhKBYHG4n",11,5,878006456548810752,Lisa Ring,LisaRingGA01,"Savannah, GA","Democratic Chair of GA-01, strong Progressive #StandwithLisa #LRFC2020 #M4A #ClimateAction #Resister #Justice #nocorporatemoney",5126,8259,,
Sat Sep 28 19:54:30 +0000 2019,1178035271910055936,St. Michael's Catholic Community in Calgary will be live-streaming a federal election debate moderated by political… https://t.co/C2YNIQO1RT,5,4,4870632564,rightnowhq,RightNowHQ,Canada,RightNow is a Canadian not-for-profit committed to nominating and electing #prolife candidates willing to vote in favour of common-sense legislation. #cdnpoli,1854,1933,,
Sat Sep 28 21:20:22 +0000 2019,1178056882893705216,Protect Canadian borders so we can protect genuine refugees. Only the #PeoplesParty  has a plan to secure our borde… https://t.co/ULAAoU2vOj,4,4,1012061774638706694,Learning Portal,PortalLearning,,🇨🇦✝️❤️Facts matter. Feelings matter but aren’t facts. Truth is not always politically correct. Freedom is worth fighting for. Jesus is LORD.,1575,1262,,
Sat Sep 28 22:13:02 +0000 2019,1178070137745891330,Turning our backs on refugees defies the human rights our nation claims to uphold. Our immigration system must be r… https://t.co/c6DtPdQw8G,6,4,42980426,FIRM Action,FIRM_Action,Across the United States,FIRM Action is a national effort of individuals & grassroots orgs to build support for humane comprehensive immigration reform. Check out @re4mimmigration.,3622,31704,,
Sat Sep 28 23:38:10 +0000 2019,1178091562171019264,"totally racist screw ups!

https://t.co/7qJArh4n9b",1,2,174741958,Jacqueline,AronzJacqueline,Kentuckiana,"LOVE OUR NEW PRES & VP!!! WADO!
DAMN PROUD DEMOCRAT AND AMERICAN!!!
#Teampelosi
#Biden2020
Unitarian, large family, love nature
Prefer animals 2 people🐾🐾",8043,8308,,
Sat Sep 28 23:09:00 +0000 2019,1178084219614060544,"Translation websites themselves, like Google Translate, say they shouldn't replace human translators. But the U.S.… https://t.co/vdqbPmx4nJ",1,1,283880734,Brad Streicher,bradrstreicher,"Austin, TX","Investigative reporter @kvue. Proud @USC grad. Big fan of public records, outdoor adventures and talking about California. Send tips to bstreicher@kvue.com.",793,1718,,
Sat Sep 28 22:14:06 +0000 2019,1178070404147007489,"@JoelAltona @brucerossbrc I told him our government was cruel, that refugees should be given permanent protection n… https://t.co/N3PDgRPSfA",1,1,3622601179,"Ju Avril, Crowdfund #reclaimthenews",reclaimthenews,"Sydney, New South Wales",http://chuffed.org/project/fund-r… Doing something tangible for change. History grad. Pro dogs.Anti RWNJs. Concerned Citizen. Owner Temples&Markets online shop.,3119,2488,immigrants|refugees,
Sat Sep 28 22:26:34 +0000 2019,1178073541524115456,"Rachel Brosnahan: Venezuelan crisis isn't about politics.: Rachel Brosnahan, Global Citizen Ambassador and star of… https://t.co/XVDGgOhPs1",0,1,48470839,𝓟𝓪𝓽𝓻𝓲𝓬𝓴,cahulaan,"Arizona, USA",🌵 🌊  🇺🇸 #TheResistance #VoteBlue #BidenHarris2020 #BlackLivesMatter #MeToo 𝔼𝕝𝕖𝕔𝕥𝕚𝕠𝕟𝕤 𝕙𝕒𝕧𝕖 𝕔𝕠𝕟𝕤𝕖𝕢𝕦𝕖𝕟𝕔𝕖𝕤 Welcome Back America!! 🇺🇸,15983,16648,,
Tue Oct 01 22:05:34 +0000 2019,1179155420377567233,I saw this op-doc and I teared up. “Shall We Dance?” but with real refugees who look like your Asian parents who yo… https://t.co/SAHFecxHyJ,276,49,88498742,viet thanh nguyen,viet_t_nguyen,los angeles,Writer. Refugee. 1st gen college. Affirmative action beneficiary. Don’t just be a voice for the voiceless. Abolish the conditions of voicelessness instead.,679,67247,,
Tue Oct 01 23:00:00 +0000 2019,1179169117992972288,"Ours is a nation built by immigrant entrepreneurs and innovators like Tina Tran Neville. 
Trump’s attacks on refuge… https://t.co/CSW3YqrF7f",169,42,815733290955112448,Rep. Pramila Jayapal,RepJayapal,"Seattle, WA","Congresswoman and lifelong organizer. Proudly serving WA-07. Co-Chair of @USProgressives, Member of @HouseJudiciary, @EdLaborCmte and @HouseBudgetDems. She/her.",2761,364014,,
Tue Oct 01 23:13:06 +0000 2019,1179172417551380480,This woman would very likely have died and so would her family if she had stayed in Uganda. They were refugees. How… https://t.co/IZnfQPIrKT,68,21,3266245188,João Kay,joao_kay,Fife Scotland,"Literature, History, Culture, Languages,Caledonia, Lusitânia.",1111,1720,,
Tue Oct 01 22:47:46 +0000 2019,1179166039990398976,Immigration Custom Enforcement (ICE) raids into Southeast Asian communities across the country are set to take plac… https://t.co/AMi71zKEHY,7,14,1107372312205000704,Khmer Anti-Deportation Advocacy,KhaagWa,,"A community effort to advocate, support, and provide resources for our community members who are unfairly targeted by I.C.E. with orders of removal.",77,260,,
Tue Oct 01 23:51:01 +0000 2019,1179181957873328128,"If teachers have to suffer through such horrid conditions, it is clear the Nauru immigration detention centre is fa… https://t.co/C2CLzsn18i",10,13,2245238034,Human Rights for All,HumanRights4A,"Sydney, New South Wales",A charitable law firm representing long term detained and complex case asylum seekers on a pro bono basis,1389,2522,,
Tue Oct 01 22:15:00 +0000 2019,1179157793317613568,"An internal manual produced by U.S. Citizenship and Immigration Services, the federal agency charged with admitting… https://t.co/9jso76R5fw",10,6,19605981,Truthout,truthout,United States,Truthout is a nonprofit news organization dedicated to providing independent reporting and commentary on a diverse range of social justice issues.,46960,180816,,
Tue Oct 01 23:20:35 +0000 2019,1179174300458336257,"Stories about immigrants and refugees are often centered on the hardships they face, especially those around my par… https://t.co/u36PwBzzCC",15,2,2327917316,Fengxue Zhang,fengjamin,"Kansas City, MO","Ah, beans. Ain't that just the way.",667,433,,
Tue Oct 01 22:15:11 +0000 2019,1179157841782939648,The Houston Refugee Consortium is speaking up against the Trump administration’s plan to drastically limit the numb… https://t.co/U88gcZI1FK,3,1,44471835,Florian Martin,Florian_News887,"Houston, TX","Business Reporter @HoustonPubMedia @HPMNews887 Houston's @NPR station; also cover criminal justice, guns & shootings",985,1553,,
Tue Oct 01 21:59:34 +0000 2019,1179153910663176193,"Under the new refugee cap, the U.S. will accept no more than 18,000 refugees this fiscal year, down from the curren… https://t.co/4jUQBcBman",0,1,562996358,Houston Public Media,HoustonPubMedia,"Houston, TX","Houston’s @NPR and @PBS station, broadcasting on 88.7 FM and Channel 8.",561,12692,BuildTheWall,WylieMcFly
Tue Oct 01 23:01:04 +0000 2019,1179169388265709568,"BREAKING: Trump told aides he wanted Mexican border closed. Asked for snake-filled moat with alligators, wall elect… https://t.co/crceSGDEpE",2,1,837648541002629120,Jewish News Agency (™),JewishNewsUSA,"New York, USA","BREAKING News, Features on global events affecting the Jewish community. We will not remain silent.
Available for speaking events.   #Jewish #JCC #Israel #IDF",5442,6116,,
Thu Oct 10 22:30:01 +0000 2019,1182423063155105792,Hey @AndrewScheer we noticed that you missed a few things in the press release on your new immigration policy yeste… https://t.co/fyenBPUrLF,20,21,48817946,AmnestyCanada,AmnestyNow,Canada,"Your official source for human rights events, news, and actions taking place across Canada. Feed run and maintained by Amnesty International Canada. Amnesty.ca",1752,31045,immigration,BernieSanders|JoeBiden
Thu Oct 10 23:15:06 +0000 2019,1182434410228047872,Scheer chaos at the border: Conservatives pitch Trump-style immigration tactics #ceiu #psac @psacnat… https://t.co/PS8ZkfxeDr,5,7,870273863174770688,CEIU-SEIC.ca,ceiuseic,,Canada Employment & Immigration Union/Syndicat de l'emploi et de l'immigration du Canada #canlab,566,444,ceiu|psac,psacnat
Thu Oct 10 18:38:05 +0000 2019,1182364695866433536,"Important #ethnlp #ethicalCS story here: 

https://t.co/BGGz2wVyTA

/1",19,6,172179385,🕯️❄️Emily M. Bender❄️🕯️,emilymbender,,"Professor, Linguistics, University of Washington // Faculty Director, Professional MS Program in Computational Linguistics (CLMS) // she/her",1670,15496,ethicalCS|ethnlp,
Thu Oct 10 21:01:04 +0000 2019,1182400679161335809,LGBTQ refugees face challenges when navigating the refugee claims process. LGBTQ asylum seekers are expected to pro… https://t.co/PMI4rkvFDN,4,3,59472451,The 519,The519,"Toronto, Ontario, Canada","The 519 is committed to the health, happiness and participation of LGBTQ2S folks in Toronto and beyond.
Support our COVID-19 response: https://bit.ly/519covid19",1301,13695,,
Thu Oct 10 20:32:38 +0000 2019,1182393522365710336,‘Feel like I’m living on death row’: refugees forced to choose visa limbo or family separation | Australian immigra… https://t.co/nNb9cSczpQ,1,3,893825913019920384,ARAN - Australian Refugee Action Network,AustRefNetwork,,An Australian national network of activist organisations working for just and humane refugee policies.,1710,1088,,
Thu Oct 10 20:34:26 +0000 2019,1182393975740583936,@SBSNews The taxpayer funded SBS supporting leftists against the Australian government: Bachelet is a leftist Charl… https://t.co/A4Rg4ANArl,5,2,541865431,Albert,al_soff,"Sydney, Australia","#AustraliansFirst  #ChinaMustPay 
Australia was better without China
Australia needs a ""D. Trump""
#AllLivesMatter
Climate Change is a Fraud
#AustralianPatrimony",233,443,,
Thu Oct 10 18:39:02 +0000 2019,1182364936699179008,"tl;dr: the US gov't is encouraging immigration officials to use machine translation in the process of ""vetting"" refugees. 

/2",0,2,172179385,🕯️❄️Emily M. Bender❄️🕯️,emilymbender,,"Professor, Linguistics, University of Washington // Faculty Director, Professional MS Program in Computational Linguistics (CLMS) // she/her",1670,15496,Director|Filmmaker|HeyXorje,XorjeO
Thu Oct 10 21:29:00 +0000 2019,1182407709922136090,This is the united America we know and love. Dallas youth designed a coloring guidebook to welcome immigrants and r… https://t.co/yx3J2gKI74,3,2,37988104,Fair Immigration Reform Movement,Re4mImmigration,Nationwide,FIRM is a national coalition of grassroots organizations fighting for humane #immigration reform and immigrant rights. Check out sister org @firm_action.,803,14482,,EleanorRylance|normanlamb
Thu Oct 10 20:30:29 +0000 2019,1182392981338415104,"TEN CUIDADO CON LOS ESTAFADORES

Quien te asegure que puede “arreglar tus documentos migratorios”, tramitar una vis… https://t.co/JEdFL2acdB",1,2,109289096,Embamex Canada,EmbaMexCan,"Ottawa, ON | Canada",Embassy of Mexico in Canada | Ambassade du Mexique au Canada | Embajada de México en Canadá,4030,11386,,
Thu Oct 10 20:01:56 +0000 2019,1182385799658168320,"@cairdfw to Hold #Islamophobia Conference on Rising Hate Against Minorities
https://t.co/TfllYyCkbH
#Texas #Dallas… https://t.co/j3e6eAGf23",1,1,203060129,CAIR National,CAIRNational,"Washington, D.C.",Leading advocates for justice and mutual understanding,10629,53156,Dallas|Islamophobia|Texas,cairdfw
Sat Oct 19 21:11:43 +0000 2019,1185664849159823362,"✈️ Our team is heading to #Detroit, Michigan for the #NIIC2019, the largest conference on #immigration in the U.S.… https://t.co/Yr9R39QECT",3,2,59900070,Mi Familia Vota,MiFamiliaVota,"AZ, CA, CO, FL, NV, TX",Mi Familia Vota is a national organization working to build political power within Latino and immigrant communities through increased civic participation.,2392,13809,,Olufemiloye
Sat Oct 19 22:26:52 +0000 2019,1185683761528262656,Media coverage of Trump's attacks on Somali refugees shows that his racist incitement has become normalized   https://t.co/zDQCHElXpq,1,1,34631113,Gonzo Socialism #FreeAssange,RealDavidCarter,London UK,"Former child, democratic Socialist, free thinking, music fan. Netizen of the revolution Preston North End fan #JailTheGuiltyBankers NO LISTS I BLOCK #JoinAUnion",6028,6108,EU,RealthingUlli|ghevgss
Sat Oct 19 21:08:32 +0000 2019,1185664047473188864,DJ Riobamba Set To Release Debut EP And A Protest Concert Outside I.C.E. HQ's https://t.co/wYzvyJHnHi #protestmusic… https://t.co/a41BwrsSyf,1,1,1002092209469034496,Shouts - Music From The Rooftops!,shoutingmusic,Europe,We publish interviews with protest musicians and socially conscious artists along with news and exclusive premieres. Contact: editor@shoutsmusic.blog,120,113,,ohboywhatashot
Sat Oct 19 21:19:39 +0000 2019,1185666848223891457,"RT @tlshields85: Former Liberal MP says Immigration Minister Ahmed Hussen “must resign” – True North News
There’s still a crisis at our bor…",0,0,59968084,Sharon,SmilingSerenity,,,274,296,,tlshields85
Sat Oct 19 21:06:04 +0000 2019,1185663428997742592,"RT @tlshields85: Former Liberal MP says Immigration Minister Ahmed Hussen “must resign” – True North News
There’s still a crisis at our bor…",0,0,3277724156,Dani King,DaniTrevdani,,,224,113,,Change|ThangamMP|foeeurope
Sat Oct 19 21:06:09 +0000 2019,1185663451055550464,"RT @tlshields85: Former Liberal MP says Immigration Minister Ahmed Hussen “must resign” – True North News
There’s still a crisis at our bor…",0,0,897157166,TRUDEAU OUT ! - NO U.N. COMPACT !,remvcc,"French parents, born in Mexico, proud Canadian by choice. Conservative. Not PC. Pro Free-Speech. Pro Israel Zionist. Anti-Trudeau Pro-Trump.",🇨🇦🇲🇽🇮🇱🇫🇷🇺🇸,4911,2422,QueensSpeech,JamesMelville
Sat Oct 19 21:08:10 +0000 2019,1185663957895266304,"RT @highcountrynews: The Twin Falls Refugee Center is thriving, despite federal cuts to the U.S. Refugee Admissions Program that has forced…",0,0,1321475599,Max Gordon,mgordon1983,"Olympia, WA","Born and raised in Seattle area. Community-minded person, especially when it comes to our public lands. Also, a beer connoisseur and news junkie.",869,92,Evangelicals,
Sat Oct 19 21:09:20 +0000 2019,1185664249743454208,RT @shoutingmusic: DJ Riobamba Set To Release Debut EP And A Protest Concert Outside I.C.E. HQ's https://t.co/wYzvyJHnHi #protestmusic #pro…,0,0,59096822,National Refugee Institute,atrefugees,,Following the plight of #refugees worldwide. Retweet does not mean endorsement.,898,5101,,
Sat Oct 19 21:13:47 +0000 2019,1185665368276135936,"RT @MiFamiliaVota: ✈️ Our team is heading to #Detroit, Michigan for the #NIIC2019, the largest conference on #immigration in the U.S. We're…",0,0,1070514727548145665,LYDIA ARANDA MA. President S. Arizona Border Team,USMCAmericas,🇲🇽 Southern AZ Border Team,Governors Office Arizona Small Business Director / Wells Fargo Vice President (FMR) Join LA CAUSA! http://CPLC.org & http://HSF.NET All Things SUR DE AZ!,4992,721,QueensSpeech,JamesMelville
Sat Oct 19 21:15:47 +0000 2019,1185665872997818373,@cselley Here’s your source: https://t.co/Bc9068E50I,0,0,740916038,Brian Beard,BrianBeardo,Ottawa,"Teacher who loves to be taught. McMaster Alimumni (SGES). What is there, why there and why care?",212,92,,
Mon Oct 28 23:50:58 +0000 2019,1188966416164237313,"Democrats want to open a new immigration route into U.S. jobs &amp; housing for 'victims of climate change.' 
How can a… https://t.co/qal9CWxwRE",127,93,266800454,Neil Munro,NeilMunroDC,Washington D.C.,"I follow the money through immigration politics.
Born Irish, then a Cold War bridegroom. Former Defense News, WashiTech, National Journal, TheDC. Lucky me.",1481,10859,,
Mon Oct 28 22:21:27 +0000 2019,1188943891728338945,"Just changed all our local ""illegal alien"" subject headings to ""undocumented immigrant."" You don't have to wait for… https://t.co/IkWXUdA6xj",227,37,58806096,Marie,eleneariel,,"Librarian-on-hiatus, adventurer & strong, independent woman; also very tired. Curious about everything. I wield my joy like a broadsword. she/her",568,1463,,EleanorRylance|normanlamb
Mon Oct 28 20:35:49 +0000 2019,1188917305620582400,“...we need to confront the truth at the heart of this. We have a system that causes deep and irreparable harm to p… https://t.co/WbuwbJwvOj,0,2,359742735,RACS,RACSaustralia,www.racs.org.au/donate/,The Refugee Advice & Casework Service provides effective legal services for people seeking protection and advocates for policy reform and justice.,7833,9451,,
Mon Oct 28 20:50:03 +0000 2019,1188920888323764224,Democrats Draft Plan to Import Huge Numbers of ‘Climate Refugees’ https://t.co/vA1a89ukQx #Economy #Immigration via… https://t.co/G4lJdkwMNE,0,1,312149882,Chris 🇺🇸,Chris_1791,"Philadelphia PA, USA","✝ Catholic. 🤰🏼 Pro-Life. 👨🏻‍🎓 Ph.D. CS 💻, U of Penn. ❤ 🐈 Cats, 🐕 Dogs & Animals #AdoptDontShop T2D🩸 1A, 2A, Philly FF family since 1947 🚒 MAGA 2024",33850,73832,,1776Stonewall|5ilence_d0g00d|ScottPresler|Sta1tOfLiberty1|TrumperSeaney|__Sassafras_|hredriders|patriotjenn
Mon Oct 28 23:58:15 +0000 2019,1188968249142267905,"RT @NeilMunroDC: Democrats want to open a new immigration route into U.S. jobs &amp; housing for 'victims of climate change.' 
How can anyone o…",0,0,32304381,John Binder 👽,JxhnBinder,Club Alien,"l’immigration et mode @BreitbartNews
JBinder@breitbart.com",346,17794,,zegmaar_LydeLa
Mon Oct 28 21:12:43 +0000 2019,1188926592573214721,RT @FAIRImmigration: The resettlement of refugees and asylum seekers in the U.S. costs federal taxpayers approximately $1.8 billion a year…,0,0,727917362960162816,veritasmatters,Veritasmatters,,,424,246,,
Mon Oct 28 20:56:49 +0000 2019,1188922589181165568,RT @FAIRImmigration: The resettlement of refugees and asylum seekers in the U.S. costs federal taxpayers approximately $1.8 billion a year…,0,0,1590115357,Kianainhi 🌴🌊,kianainhi808,,Ua Mau Ke Ea o Ka 'Aina i ka Pono  #808Pride #mana #islandculture,458,523,QueensSpeech,JamesMelville
Mon Oct 28 20:57:15 +0000 2019,1188922698593910786,RT @FAIRImmigration: The resettlement of refugees and asylum seekers in the U.S. costs federal taxpayers approximately $1.8 billion a year…,0,0,204786099,Pete Cummings 🇺🇸,_PeteCummings,"Sea Island, Ga.",Faith - Family - Freedom,1389,4964,Evangelicals,
Mon Oct 28 20:59:15 +0000 2019,1188923201679740930,RT @FAIRImmigration: The resettlement of refugees and asylum seekers in the U.S. costs federal taxpayers approximately $1.8 billion a year…,0,0,14168372,JohnGilmore,Shabbosgoy,St. Paul MN,"Contributor to @thehill, published at @AlphaNewsMN, @securefreedon. Called ""a sad & hateful man"" by Ilhan Omar. Blogs at MN Conservatives: https://t.co/4wH1c2ZtoU",2042,6724,,ohboywhatashot
Mon Oct 28 21:00:37 +0000 2019,1188923547768541186,RT @FAIRImmigration: The resettlement of refugees and asylum seekers in the U.S. costs federal taxpayers approximately $1.8 billion a year…,0,0,4421697737,Andy,arortiz27,,,14,27,,
Fri Nov 01 20:58:00 +0000 2019,1190372441622753281,#queensu warns of a criminal scam currently targeting students. Callers claim they are Canada Revenue Agency (CRA)… https://t.co/IUcFPBCXK2,4,18,19429847,Queen's University,queensu,"Kingston, ON Canada","Queen's is one of Canada's leading universities with an international reputation for scholarship, social purpose, and spirit.",313,63868,,peytnhaag
Fri Nov 01 17:55:07 +0000 2019,1190326416786763777,Your passport was lost or stolen abroad? Don’t panic! Start by reporting the loss or theft to the nearest Governmen… https://t.co/XOcgfuSpwQ,17,9,786937495,Travel.gc.ca,TravelGoC,,Travel advice from the Government of Canada ǀ Français : @VoyageGdC,228,82525,,
Fri Nov 01 15:09:40 +0000 2019,1190284780706750464,@5ilence_d0g00d @TrumperSeaney @PatriotJenn @hredriders @ScottPresler @Sta1tOfLiberty1 @1776Stonewall @__Sassafras_… https://t.co/TtagKzFzXT,7,5,905427676667588609,Kyle Reese,KyleRee86849765,USA! USA! USA!,"I bea who I bee, naught two zmart, knott too dum...

""I could be wrong, I could be right""...
""I could be right, I could be wrong""...",13181,12520,,1776Stonewall|5ilence_d0g00d|ScottPresler|Sta1tOfLiberty1|TrumperSeaney|__Sassafras_|hredriders|patriotjenn
Fri Nov 01 14:22:26 +0000 2019,1190272892984053761,ISANS CEO @JenniferHalifax presents about addressing issues of immigration in the Canadian federal election at the… https://t.co/wo7De4ZVo7,16,2,102062232,ISANS,isans_ca,"Halifax, Nova Scotia, Canada","Immigrant Services Association of Nova Scotia: We help immigrants build a future in Nova Scotia.
Questions: info@isans.ca 
Media requests: media@isans.ca",646,4898,BuildTheWall,WylieMcFly
Fri Nov 01 17:01:10 +0000 2019,1190312841204707328,https://t.co/477MaKb50d,2,2,477864155,Henry Makow,HenryMakow,Winnipeg,An Oasis for the Awake,849,25520,QueensSpeech,JamesMelville
Fri Nov 01 15:08:15 +0000 2019,1190284424392429568,"While the U.N. calls its project ""refugee resettlement,"" the Islamists call it ""hijra,"" or immigration jihad.… https://t.co/hM3rWaWTDL",1,1,930849029617053696,Steph BlueberryOps,BlueberryOps,"Florida, USA","MAGA Mom, Navy Veteran",1147,567,,
Fri Nov 01 21:17:36 +0000 2019,1190377372454936581,@sendavidperdue @SenThomTillis You're implying that imagrants and refugees are dangerious criminals when you have o… https://t.co/oyMit6aLvP,3,1,37290928,Vesper X,djvesper,"Atlanta, GA","Musician, Producer, DJ, Empath & shaman specializing in 432hz/528hz music. Love & Light ALWAYS.
| https://t.co/vsc73gOT2U |
https://t.co/Jemhq8b4zt | IG: @DJVesper",554,582,,SenThomTillis|sendavidperdue
Fri Nov 01 16:12:05 +0000 2019,1190300485414268929,"Interested in working at Immigration, Refugees and Citizenship Canada / Immigration, Réfugiés et Citoyenneté Canada… https://t.co/lIJdfK9i1j",0,1,892473180576772097,EURUS Career,EURUS_Career,"Ottawa, Ontario","Helping students and alumni @EURUSCarletonU to find #jobs and #internships. Check out EURR 4206/5301 Internship+Applied Policy course, offered in Winter'20📚🤓",409,172,,
Fri Nov 01 18:06:49 +0000 2019,1190329359061725185,Democrats Move to Create New Protected Class – Climate Refugees. The Goal Is Increased Mass Immigration - https://t.co/3xbzrhTsZK,0,1,823238305177370624,MiniKraken@SaveTheTinyHumans - SameOnParler,MBProtectLife,,"Catholic, Pro-Life Wife, Mother, Grand Mother, Conservative, Reformed City Girl",2333,2055,,
